Neutral,conservative,@conservativeinfo,Wisconsin Voter Turnout was a virtual statistical impossibility IF YOU SUPPORT DONALD TRUMP PLEASE ECHO THIS POST AND FOLLOW US! #TRUMP #TRUMP2020 #maga #TRUMP #trumptrain #donaldtrump #presidenttrump #conservative #meme #news #gop #covid19 #qanon #thegreatawakening #blm #teamtrump #patriotprayer #proudboys #wwg1wga #q #qarmy #prolife #deepstate #keepamericagreat #makeamericagreatagain #votetrump2020 #godblessamerica #bidencrimefamily #arizona #kag2020 #pennsylvania #stopthesteal #fraud #truth #Election2020 #stopthesteal #VoterFraud #ElectionFraud #USPolitics #maga #TRUMP2020  #Wisconsin
Neutral,conservative,@bbcpoliticsusa,Wisconsin Voter Turnout was a virtual statistical impossibility IF YOU SUPPORT DONALD TRUMP PLEASE ECHO THIS POST AND FOLLOW US! #TRUMP #TRUMP2020 #maga #TRUMP #trumptrain #donaldtrump #presidenttrump #conservative #meme #news #gop #covid19 #qanon #thegreatawakening #blm #teamtrump #patriotprayer #proudboys #wwg1wga #q #qarmy #prolife #deepstate #keepamericagreat #makeamericagreatagain #votetrump2020 #godblessamerica #bidencrimefamily #arizona #kag2020 #pennsylvania #stopthesteal #fraud #truth #Election2020 #stopthesteal #VoterFraud #ElectionFraud #USPolitics #maga #TRUMP2020  #Wisconsin
Neutral,conservative,@conservativeinfo,Wisconsin Voter Turnout was a virtual statistical impossibility IF YOU SUPPORT DONALD TRUMP PLEASE ECHO THIS POST AND FOLLOW US! #TRUMP #TRUMP2020 #maga #TRUMP #trumptrain #donaldtrump #presidenttrump #conservative #meme #news #gop #covid19 #qanon #thegreatawakening #blm #teamtrump #patriotprayer #proudboys #wwg1wga #q #qarmy #prolife #deepstate #keepamericagreat #makeamericagreatagain #votetrump2020 #godblessamerica #bidencrimefamily #arizona #kag2020 #pennsylvania #stopthesteal #fraud #truth #Election2020 #stopthesteal #VoterFraud #ElectionFraud #USPolitics #maga #TRUMP2020  #Wisconsin
Neutral,conservative,@Darrenhodges,"I am making this post so it will show back up as a future memory on my timeline: Today is three days after the 2020 election with no declared winner. Gasoline is currently $1.80-2.10 per gallon. Interest rates are 2.65% for a 30 year mortgage. The stock market closed at 28,323, even though we have been fighting COVID for 9 months. Our GDP growth for the 3rd Qtr was 33%. We had the best economy ever until COVID and it is recovering well. We have not had any new wars or conflicts in the last 4 years. North Korea has been under control and has not been testing any missiles. Isis has not been heard from for over 3 years. The housing market is the strongest in over 20 years. Homes have appreciated at an unbelievable rate and sell within hours of going on the market, with multiple offers. I hope our new leadership can build on these things and can keep them going, but if I were a betting person I would bet that the only place we will see these results will be in this post."
Neutral,conservative,@FOVaughanOhioGOP,So did COVID-19 disappear ??
Neutral,conservative,@jamesmclean67,Did covid disappear Nov 3
Neutral,conservative,@Dottsey,"I got covid, Sean. Was so sick."
Neutral,conservative,@Jamieiwanski,They are celebrating in the streets with large groups but voting in person was too dangerous. Is covid over now?
Neutral,conservative,@GeorgeMFWashington,I see the Daily Mail is softening us up for the miraculous end of COVID on January 20th
Neutral,conservative,@DaveNorton57,"So if the Left’s coup holds up and Biden takes office, does that mean we have to wait until January for COVID to be over?"
Neutral,conservative,@DewsNewz,The odds that no Demtards have tested positive for COVID are about the same as Joe Biden getting 130K sole votes at 5am.
Neutral,conservative,@DewsNewz,The odds that no Demtards have tested positive for COVID are about the same as Joe Biden getting 130K sole votes at 5am.
Neutral,conservative,@DewsNewz,The odds that no Demtards have tested positive for COVID are about the same as Joe Biden getting 130K sole votes at 5am.
Neutral,conservative,@DewsNewz,The odds that no Demtards have tested positive for COVID are about the same as Joe Biden getting 130K sole votes at 5am.
Neutral,conservative,@GavinMcInnes,Libs: you can’t vote in person because of Covid. Also libs: We won! Let’s party!
Neutral,conservative,@DewsNewz,The odds that no Demtards have tested positive for COVID are about the same as Joe Biden getting 130K sole votes at 5am.
Neutral,conservative,@DewsNewz,The odds that no Demtards have tested positive for COVID are about the same as Joe Biden getting 130K sole votes at 5am.
Neutral,conservative,@BryantTurnage,"When your wife has to go to DC and they require Covid Test Results. Echoes of ""Papers...give us zee papers"""
Neutral,conservative,@aiverie,So covid has served its purpose. China released it to destroy our economy and provide rationale for mail-in ballots and election extension.
Neutral,conservative,@aiverie,So covid has served its purpose. China released it to destroy our economy and provide rationale for mail-in ballots and election extension.
Neutral,conservative,@2Vornot2V,"Facebook has plenty of time to censor you, but since COVID is rampant in Bangladesh they have no time for your appeal. Thank you for your understanding. Understand this, Zuckerberg 🖕"
Neutral,conservative,@AmericanKate,💥💥💥💥💥 Covid-19 is an organized propaganda effort by the media and the Democrat left enabled by Chy-na STOP WEARING MASKS!  🇺🇸🇺🇸🇺🇸🇺🇸🇺🇸
Neutral,conservative,@BIGDAWG52,Pfizer says early analysis shows its Covid-19 vaccine is 90% effective   Wow....do you think this announcement is based on some recent event?
Neutral,conservative,@IndieThinker79,No mask? No problem? Democrats suddenly found a magical cure for Covid as thousands rally in the streets in celebration of Joe Biden’s “victory” - sans masks.
Neutral,conservative,@IndieThinker79,No mask? No problem? Democrats suddenly find magical cure for Covid as thousands rally in the streets in celebration of Joe Biden’s “victory” - sans masks.
Neutral,conservative,@Dannmartin,"I been talking about the Islamic Turd government going to ban Christmas in Canada for years, well here it is.  Trudeau warns there ‘may not be’ Christmas in Canada because of COVID-19 | News | LifeSite"
